{"attention_cells":[],"customer":{"phone":"+15550001111","phone_status":"claimed"},"device_id":"device-e11-fixture","display_number":"K-2026-000002","header":{"captured_at":"2026-02-03T04:05:06Z","invoice_number":"POS-E11-0042","printed_date":null,"printed_time":null},"invoice_id":"inv-e11-b-revoked-b-0001","issued_content_sha256":"5cc6f34033a287c5fb7d6d3a4783e2d538bb53f7c113aa01fc1c9b1b3925291b","line_items":[{"line_total":1000,"product_name":"نمونه کالا","quantity_millis":1250,"unit_price":800}],"mode":"B","operation_id":"op-create-e11-revoked-b-0001","provenance":{"engine_version":"synthetic-e11-engine-1","fields":{"customer":{"phone":"captured","phone_status":"native"},"device_id":"native","display_number":"native","header":{"captured_at":"derived","invoice_number":"untrusted","printed_date":"unavailable","printed_time":"unavailable"},"invoice_id":"native","line_items":[{"line_total":"captured","product_name":"captured","quantity_millis":"captured","unit_price":"captured"}],"operation_id":"native","public_token":"native","store_id":"native","summary":{"extra_amounts":{},"payable":"captured","subtotal":"captured"}},"image_sha256":"aaaaaaaaaaaaaaaaaaaaaaaaaaaaaaaaaaaaaaaaaaaaaaaaaaaaaaaaaaaaaaaa","template_library_id":"synthetic-e11-template-v0"},"public_token":"AAAAAAAAAAAAAAAAAAAAAA","schema_version":"0","state":"REVOKED","state_history":[{"device_id":"device-e11-fixture","from_state":"DRAFT","operation_id":"op-e11-revoked-b-0001-transition-1","to_state":"EXTRACTED"},{"device_id":"device-e11-fixture","from_state":"EXTRACTED","operation_id":"op-e11-revoked-b-0001-transition-2","to_state":"VALIDATED"},{"device_id":"device-e11-fixture","from_state":"VALIDATED","operation_id":"op-e11-revoked-b-0001-transition-3","to_state":"ISSUED"},{"device_id":"device-e11-fixture","from_state":"ISSUED","operation_id":"op-e11-revoked-b-0001-transition-4","to_state":"REVOKED"}],"store_id":"store-e11-synthetic","summary":{"extra_amounts":{},"payable":1000,"subtotal":1000}}
