{"attention_cells":[],"customer":{"phone":"+15550001111","phone_status":"claimed"},"device_id":"device-e11-fixture","display_number":"K-2026-000001","header":{"captured_at":"2026-02-03T04:05:06Z","invoice_number":null,"printed_date":null,"printed_time":null},"invoice_id":"inv-e11-a-issued-a-0001","issued_content_sha256":"4173d40539830b7386516ab6a5891b055d796e683cd96769ffac6e50169563fc","line_items":[{"line_total":1000,"product_name":"نمونه کالا","quantity_millis":1250,"unit_price":800}],"mode":"A","operation_id":"op-create-e11-issued-a-0001","provenance":{"engine_version":null,"fields":{"customer":{"phone":"native","phone_status":"native"},"device_id":"native","display_number":"native","header":{"captured_at":"derived","invoice_number":"unavailable","printed_date":"unavailable","printed_time":"unavailable"},"invoice_id":"native","line_items":[{"line_total":"native","product_name":"native","quantity_millis":"native","unit_price":"native"}],"operation_id":"native","public_token":"native","store_id":"native","summary":{"extra_amounts":{},"payable":"native","subtotal":"native"}},"image_sha256":null,"template_library_id":null},"public_token":"AAAAAAAAAAAAAAAAAAAAAA","schema_version":"0","state":"ISSUED","state_history":[{"device_id":"device-e11-fixture","from_state":"DRAFT","operation_id":"op-e11-issued-a-0001-transition-1","to_state":"EXTRACTED"},{"device_id":"device-e11-fixture","from_state":"EXTRACTED","operation_id":"op-e11-issued-a-0001-transition-2","to_state":"VALIDATED"},{"device_id":"device-e11-fixture","from_state":"VALIDATED","operation_id":"op-e11-issued-a-0001-transition-3","to_state":"ISSUED"}],"store_id":"store-e11-synthetic","summary":{"extra_amounts":{},"payable":1000,"subtotal":1000}}
