{"attention_cells":[],"customer":{"phone":"+15550001111","phone_status":"claimed"},"device_id":"device-e11-fixture","display_number":null,"header":{"captured_at":"2026-02-03T04:05:06Z","invoice_number":"POS-E11-0042","printed_date":null,"printed_time":null},"invoice_id":"inv-e11-b-draft-b-0001","line_items":[{"line_total":1000,"product_name":"نمونه کالا","quantity_millis":1250,"unit_price":800}],"mode":"B","operation_id":"op-create-e11-draft-b-0001","provenance":{"engine_version":"synthetic-e11-engine-1","fields":{"customer":{"phone":"captured","phone_status":"native"},"device_id":"native","display_number":"unavailable","header":{"captured_at":"derived","invoice_number":"untrusted","printed_date":"unavailable","printed_time":"unavailable"},"invoice_id":"native","line_items":[{"line_total":"captured","product_name":"captured","quantity_millis":"captured","unit_price":"captured"}],"operation_id":"native","public_token":"native","store_id":"native","summary":{"extra_amounts":{},"payable":"captured","subtotal":"captured"}},"image_sha256":"aaaaaaaaaaaaaaaaaaaaaaaaaaaaaaaaaaaaaaaaaaaaaaaaaaaaaaaaaaaaaaaa","template_library_id":"synthetic-e11-template-v0"},"public_token":"AAAAAAAAAAAAAAAAAAAAAA","schema_version":"0","state":"DRAFT","state_history":[],"store_id":"store-e11-synthetic","summary":{"extra_amounts":{},"payable":1000,"subtotal":1000}}
